stars	text
5.0	"b""ended up here because Raku was closed and it received great ratings on Yelp.  I'm so glad I came here.  One of the better meals I've had.  Started off with the mushroom dish and the lettuce wrap.  both were amazing. the lettuce wrap is like having a flavor party in your mouth.  also had the panang duck which was terrific. highly recommend all three dishes. one dish that wasn't so good was the seabass with drunken noodles. overall it was an excellent meal, intimate setting, and great service. definitely will be back."""
1.0	"b'I tried this place because my girls are away for a month, and I REALLY wanted to try to wait until they came back, because NOBODY can hold a candle to them, but my toes were desperate.  When I went in, they were almost twice what I usually pay to begin with.  Then, before starting the pedicure, I specifically told them I already had gel polish on my toes.  They didn\'t tell me right then and there ""that will be an extra $5\'.  No, they waited until it was time to pay, and not only charged me for that, but they charged me all kinds of extra fees that I didn\'t even ask for!  I had also informed the girl that my toenail was loose and needed gluing.  While I was looking at my phone, all of a sudden I felt this sensation, and she RIPPED OFF MY TOENAIL!!!!  Without even asking me!!!!!!  So then she had another girl come and put acrylic on there since the nail underneath was only 1/2 grown.  Again, they didn\'t tell me how much this would be, or even ask my permission, they just charged me at the end.  \n\nThe added stone \'massage\' was barely a massage!  She rubbed the stones up my lower legs a couple times, and that was it.  It lasted about 30 seconds.   And when I asked for a design, I\'m used to getting a board with a bunch of designs to choose from.  She didn\'t even ask me what I wanted, she just painted a few lines on my two toes and then charge me 5 MORE dollars for that! \n\nUgh, I don\'t care HOW ugly my toes look next time, I will NEVER go anywhere else besides Bella Nails again, they ROCK!!!!!!!  This place was appalling.  I didn\'t want to make a scene, so I just paid the money, but I will NEVER go back!!!!!!!'"
1.0	b'Love this place downtown but the Scottsdale location has no manners. Sat at bar for 10 min while bartender ignored us. No menu, no water. We walked out and they could have cared less.'
5.0	b'Best chinese resto. Highly recommended. 5 stars. Let us support this business. Best in the west valley. Trust me you wont gi wrong coming to this place'
1.0	"b""Came here on a Thursday night at 6:30 p.m. My friends and I had a reservation, but it was not needed - the place was almost empty.\n\nSERVICE: Extremely Poor\n\nWhile I enjoyed the company of my friends, I would not come back to this restaurant, primarily because of the poor service. Once we were all seated, we were not greeted by anyone for over half an hour, and when someone did come by, we asked whether we could place our orders, to which he said he could not; he's doing something else - so we waited at least another 15 minutes before someone came to finally take our orders. \n\nMAIN: Caprese Salad\n\nThe salad was okay - a bit salty for my liking. I personally did not find this dish filling, so I ordered the sweet potato fries as well (See below).\n\nMAIN: Sweet Potato Fries (this was worth it) \n\nThese fries were actually very delicious - crispy on the outside and soft on the inside. If you visit this restaurant, I would recommend this particular dish, especially given the price ($8) and the portion size (it was quite large - almost the size of a large plate)."""
2.0	b'Went here last weekend and was pretty disappointed. They did not have one thing that was pictured and recommended on yelp as being good. We started off with the steak grilled skewers which were just Ok, nothing special. My freind got the lasagna and I got some special chicken dish. They were both pretty bland and lacking that kick. Our waitress was really nice and got the manger to switch out our dishes. My freind got the hamburger and I got the shrimp scampi. Her hamburger was better then the lasagna but was still lacking flavor. My scampi was better then the chicken but was also still under seasoned and the noodles were a bit under cooked. With such a big name attached to this restaurant and going on such an empty stomach we had such high hopes. The service was great which is why i gave it three stars.'
5.0	"b'This place epitomizes the rumored transformation that is in the process of taking place in Pittsburgh. Great food, drinks, and service, but the atmosphere is second to none. Definitely a must visit for locals and visitors alike! You will not feel like you\'re in ""Pittsburgh"".'"
4.0	"b""Dinner Was Fantastic! Service was great We started with the corn soup and the tuna tartare. We shared the Filet and Scallops. Both delicious entrees! We didn't realize the steak came with potatoes and ordered two sides Mac and cheese and shishito peppers. I thought the peppers were really hot but I'm a whimp I guess! We will definitely come back"""
1.0	"b""They keep there appointments on time and are pretty efficient. However I am very disappointed in how they think that just because I am a girl that I do not know what is going on with my car's tires. The guy that helped me out told me that my two front tires tread was extremely low and that I would be needing two new tires in a month or two. He told me that he could show me the same tires I have on there now and how much they would be. When the I had taken my car to the other Discount Tire they told me it that my tread was actually still really good for how many miles I have on my car. When he told me the price of the two tires it was around $280. Which I had just bought two new ones a couple months before that and they were the same price. So when I bought the two new tires my tire pressure light came on not that long after that. I honestly feel like the tires were not even new and did not look worth $280."""
1.0	"b""Met a friend for dinner there tonight. The server only brought us one menu. After she brought us a couple of Cokes she didn't come to our table for 20 mins. After trying to get her attention a few times when she walked by we decided to just order off the bartender. We received the starters and the mains at the same time. The wings, brisket, and mac and cheese were alright at best. At this point we hadn't seen the server since she brought the food, so we had to go to the bar for more napkins and refills on the Cokes. The most we actually saw our server was when she hovered over us as we put the tip into the handheld credit card terminal. \n\nFood was somewhere between okay and decent. Service was somewhere between piss poor and terrible."""
4.0	"b""Another solid BBQ place in Calgary. This is definitely a great place to go if you are craving something smokey and delicious. \n\nI actually noticed this place because I wandered by when I was walking downtown and it's impossible to miss that lovely smokey/BBQ smell if you're on the block. However, it looks kind of like a hole in the wall. The entrance doesn't look like it's been updated in years, and that's ok because it just adds character. The entire decor is wood/country (to include buffalo head on the wall) and there is also a downstairs where there is live music on the weekends.\n\nOk onto the food. I have been here a couple of times now, so I think I can comment on the menu pretty well. My friends and I have ordered the brisket, the catfish, the veggie burger, the mac n cheese, the cesar salad, the chili, and the garlic fries. If I had to review this place based on the delicious and garliciness of their fries, this would be a 5-star review hands down. I mean, seriously, vampires beware, but everyone else should enjoy a-plenty.\n\nThe portion sizes are huge, so go hungry or be prepared for a to-go box (granted every time I've gone I have loved the food so much that I ate the entire meal.) \n\nI bet at this point in time you are wondering why I am only giving this place 4 stars then? Well, not everything is as amazing as those garlic fries. The bourbon apples are fairly tasteless, the chili is ok (the meat was very tough), and the service is also just ok. However, the catfish is delightful, the mac and cheese is also delicious, and the brisket is quality. \n\nThe specialty cocktails are also pretty good, and the beer prices are pretty decent. This is a great place to go for a long lunch, after dinner drink, or even a weekend brunch. There are vegetarian options on the menu (if you can ignore the buffalo head on the wall) and I believe even a few gluten-free options as well. It's a fairly good place to go with a large group, just make sure to call ahead. \n\nAll in all, like I said earlier, a great place for good times and smokey flavor."""
3.0	"b'One day after I satisfy my frozen yogurt craving at Kiwispoon... I get invited out to eat frozen yogurt at Piccadilly.  A rare opportunity to truly compare the two yogurt places.\n\nHere, I tried three flavors - chocolate, pumpkin, and caramel sea salt.  Added toppings of brownie bits, chocolate caramel turtles, and mochi.\n\nOverall, I liked the yogurt better at Kiwispoon. The frozen yogurt seems less rich in Piccadilly\'s and the flavors are not as strong.  The price per ounce is also marginally higher at Piccadilly\'s.\n\nThere are definitely pluses to Piccadilly\'s yogurt though.  I liked the toppings better - I thought the mochi tasted better, the brownie pieces were bigger, and the chocolate caramel turtles went great on ice cream.  The chocolate caramel turtles should be a standard topping for both frozen yogurt and ice cream places.  Also, with the huge map of Cleveland Heights behind the cash register, this feels more like an authentic ""neighborhood"" froyo joint.'"
5.0	b'I called the number provided and same day they showed up to my residence for an inspection. Was able to advise me of multiple broken and loose tiles on my roof and came out just a few days later and completed the repairs. Quoted me a good price for the repairs as well. No complaints!'
5.0	"b""Party of 3 ordered the fish tacos, pork belly banh mi, corn beef hash Benedict, and bam ham. Everything was delicious, esp the pork belly banh mi. It's tender and juicy and the baguette was nicely toasted. Love the crispy fish taco too. Their compliment chips and salsa were fresh and super good and crispy. Service was excellent. Our waitress did a great job checking up on us and serving us. I really want other food options too but I'm too full. Next time i visit i will definitely come back."""
1.0	"b""We had dinner at the Bellagio Buffet last night. The service was OK. Our server was great but kind of forgot about us towards the end of our visit. The food was cold. The only good thing there was the crab legs because they're suppose to be cold and the tacos because it was freshly made. The food was under a single lamp that didn't heat the food at all. We let the server know that the food was cold and he told the manager that was in charge. All she did was come over to ask what the problem was and said she was going to talk to the chief. Have no idea what actually happened though because we didn't see her after that. Half the buffet was closed as well so there wasn't that many options. I must say i rather go to the Rio buffet. For a high end casino this was a horrible experience."""
5.0	b'I really enjoyed my visit here.\nEverything was visually appealing to me.\nAmbiance was great. Food tasted amazing. Service was . No complaints at all'
5.0	"b""Flat out fantastic!  Have been here twice and the croissants are the bomb. Can't wait until I can try other items. THE new breakfast spot in Ahwahtukee. The service is great as well. Family run business. Come and support them."""
4.0	b'Very nice eating environment and the food are quite nice. Very native Japanese style.'
4.0	"b""notes: 1 visit, breakfast/lunch\noverall: Excellent high-end buffet, but the dessert section needs a little work.\n\nhighlights: \n- Dip the foccacia pizza in some chimichurri sauce, and it's the best pizza you'll have ever had.\n- Prime rib is excellent\n- I hate crab legs in general, but everyone else says they were great here, really fresh.\n- Cookies!  You must try their cookies.  I got so lucky and grabbed some white chocolate macadamia cookies when they were still warm.  Crispy on the sides and chewy and mouth-wateringly good.  I mean, I was stuffed beyond belief, but I couldn't stop eating it!\n- If you get in during breakfast time, do try the Portuguese sausage.  It's the only breakfast food really worth it.\n\nAvoid:\n- Gelato bar looks good, but the texture was more like the soft serve at Dairy Queen. (which I HATE) So disappointed.\n- Shrimp pad thai was served ice cold.  So gross."""
1.0	b'I am years out from surgery with sacs and I wish I could turn back time.  He promises great things them butchers your body. I should have left my body alone. It was not bAd. I was out to perfect it.  We often talk about how he ruined a good body.  I will never forget his dirty nasty slippers coming into the operating room. I should have run from the room then.'
5.0	b'Such a unique place & a great find. Our waitress was funny, knowledgable, and did a fantastic job. The food was amazing. We will definitely return and recommend this restaurant to other couples!'
5.0	b'Best Wonton soup ever!!! Delicious food and great service. We had Chicken Satay, Roti C., Wonton soup, and one of the fried noodle and shrimp dishes. Definitely will be back!'
1.0	"b'I\'ve never experienced discrimination as I did last night at this place. I was with 2 other females...we had on dresses and heels. The place was very diverse as far as how everyone was dressed. Dresses, heels, jeans, flip flops, shorts, etc. Immediately we noticed large groups of people of a particular race coming from the back of the line and going inside. We thought nothing of it...assumed they were all on lists. Then it just got weird. We noticed the guy working the door was walking back and fourth scanning the line for people he would pull out and let go inside. Every time it just happened to be groups with Caucasian people. 4 Caucasian girls were in front of us and behind a group of 4 black males. The girls were pulled out of the line and taken to the door to go inside, no talk of any lists. The guys were told they must be on a list or leave. The guys left. We watched this happen quite a few more times before we just gave up here and removed ourselves from the line. We were standing in the front for a really long time with no acknowledgement from the guy working the door. Funny thing is he didn\'t make a big announcement that we must be on a list to get inside. He was walking up to particular groups and telling them in a low tone so they would leave. I know it wasn\'t because of how we were dressed or looked....they were letting people in with jeans and flip flops. Ultimately we were let in by a bouncer at a side door. There was nothing so special going on in there that they had to be ""picky"" about who they let inside. It was like a night at Suite.  Safe to say, I will never step foot in this place again.'"
4.0	"b""We had dinner here and the food was excellent and the service couldn't have been better!\nThanks Jose! \nWe will be back for sure."""
5.0	"b""Absolutely love this place! I've been here many times and it never fails to impress me  the bff burger is unreal and the tsoynamis and cupcakes are amazing!! Everything is pretty much the best"""
4.0	"b""Here's why I don't write reviews for Chinese restaurants: I have to look up their English names... \n\nIt's so popular that I didn't try it until recently. The bubble tea here is really good. It's pricier than the one in Rose tea, but you also get more. \nI like that noodles with pork sauce. I've tried both the thin and wide/thick noodles. The wide one is less chewy and are kind of sticky. I prefer the thin one for this dish.\nDan dan noodles are different from what I was expecting. My friend liked it but it's just okay for me.\nThe noodle with wonton is flavorless to me. \nThe soup dumplings are good but not amazing. If you've never had it before, give it a try and you probably will like it.\nI'd like to try noodles with beef soup next time.\n\nThe appetizers are too pricy in my opinion. I won't pay $6 for a small plate of vegetables again...\n\nThe owner is a nice guy and I enjoyed chatting with him a little bit during dinners."""
3.0	"b""We went here Saturday for dinner. We had a 2-1 coupon. Price was $37 for two people so a good deal. \n\nVery large space, open layout.  Been here a few times years ago. I ate mostly the crab legs. Prime rib. \n\nThey provide a self serve drink area, which I think is good.  You don't have to flag down a staff to get a drink when you want one. We've all been in that situation. \n\nUnlimited alcohol, wines and beer. They have a bar area with one bartender working and a bunch of tv's to watch or get updates on games. \n\nI wouldn't go out of my way, but if I was in Mirage and hungry, I'd eat there if we had another 2-1 coupon. I wouldn't spend full retail price eating there. Other buffets on the strip are better for same price points."""
2.0	"b'Took my kids here to hang out on one fine 72 degree sunny Saturday in February. Going over the bridge, coming from Aliante Casino, you cant miss the nice view of the waterfall that is at the forefront of the park.\n\nToo bad this and the playground were the only nice things I can vouch for. \n\nThe playground is a nice fenced in little area that has a decent amount of playground equipment, swings, slides, tables, and benches. I like the soft material they use that the playground equipment is built on. There is also a sand lot area that has dinosaur bones as props. The day we went, the playground was packed. Kids were running into each other as they went down the slides. There were kids actually waiting to get on the swings! \n\nAfter a while we decided to walk around to check out the rest of the park. We see ducks everywhere especially in the pond that has the nice waterfall going into it. Unfortunately, this is where the ""nice stuff"" ends. Everywhere on the paths we were walking on were green duck crap. Which brings the question, ""Is there some kind of spray or force field they have on the playground?"" Because there were no ducks or green duck crap anywhere in the playground. Im also curious as to how many people would actually spread out a blanket and have a picnic on the grass for the crap was all over that as well. Just doing this review im starting to get grossed out thinking about that day.\n\nAfter carefully trying not to step on any crap going to the car, I made a mental note to make sure to mention all the green crap I saw in this review and to not hesitate in mentioning it to everybody I know that is either making plans on coming here or are just thinking about it. The only thing positive I can think of about that is to come here if you are on a diet. After seeing all the green crap, you probably wont be having much of an appetite and you definitely will get some exercise trying to avoid stepping on the stuff. \n\nSo, yeah, im not worried about coming back to this place any time soon in this lifetime. (You think?). Lol. Maybe as a duck.'"
5.0	"b""There is a reason I frequent Paul's Ace over the big names such as Home Depot or Lowes: the personalized assistance. Do the big name brands provide this? Yes, bit not at the same level Paul's Ace Hardware does in Tempe. If I need help, they are ready and willing to help me in every aspect of my project.\n\nThe store manager Bras personally went out if his way to assist me in gathering all the materials I needed for my current project. He knows his store, bounced around to show me all options, and seemed to have recommendations on each project. This guy must love what he does because he knows everything in the store (or he is a constant do-it-yourselfer).\n\nI am always pleased with the help I receive and am thankful this place is in my neighborhood."""
3.0	"b""In need of a burger, this was the closest location from work that wasn't your typical fast food joint.\n\nI always like to chose a signature burger so I opted for the Spicy Cajun Burger and combo'd it up with there Beer Battered Rings and a Jones Strawberry-Lime  Soda.\n\nIts a small location with an even smaller patio ( maybe 8 bar stools on a cramped balcony) that looks onto Charles Street. But definitely sit outside if you can grab a seat. Luckily the patio was vacant that late afternoon.\n\nToppings - They Spicy Cajun Burger - Avocado, jalape\xc3\xb1os, lettuce,\nJalape\xc3\xb1o havarti, tomatoes, Cajun spice & Smokey chipotle & honey mayo. There was ample toppings on the burger, I enjoyed the avocado on my burger, overall not too spicy but good kick from the sliced jalape\xc3\xb1os.\n\nMeat - Grilled perfectly, tasted average, but I found it too small compared to the bun.\n\nBun - Very soft, tasted good, but didn't hold up against the burger and all the toppings and at the end I was left with lots of bun and no more burger.\n\nBeer Battered Onion Rings - Very thick batter on these rings, golden brown, crunchy, very filling.\n\nDrink -Jones Strawberry-Lime Soda - Yummy not sour but good balance,\n\nOverall prompt friendly service, quaint little patio, average burger but good for a quick fix in satisfying the burger craving."""
2.0	"b""Sadly this place has been sold.  The gas prices have sky rocketed, some of the long term staff is gone, lottery is gone, they have run out of popular cigarettes, I tried to get gas a few days ago and the vendors / delivery trucks that used to park on the side street or off to the side were parked at the pumps...I am going to give it a little time and see if it gets better.  I have been going to this store for 15+ years, but if it doesn't shape up, I will find another...."""
5.0	b'Easily entering my top 3 restaurants in Charlotte after just one visit!\n\nPork Belly, unreal! Had an AMAZING prime NY Strip with bourbon butter jam, PHENOMENAL!'
4.0	"b""So good! They didn't make it to 5 stars due to the prices are a bit high for the amount of food and the location is a bit unsavory. \nThe decor and atmosphere was surprisingly nice, from the outside I expected to be more run down inside. The staff was very nice. We were surprised how empty the dining room was for a Friday evening.\nWe got Vegetable Samosas to start then ordered Chicken Tikka Masala, Lamb Rogan Josh, rice and plain Naan. Our only complaint was the lamb could've been more tender but everything was flavorful and delicious. \nI would definitely go again if given the chance."""
2.0	b'Employees were to busy chatting with each other. One employee had his head out the  drive thru window talking to people the entire time I was there. The cook come from outside and made my food. Did he was hands before making my food???'
4.0	"b""This random hole in the wall is located in the Park Rd. shopping center.  I had never heard of it until that fateful St. Patricks day when another beer was in order.  After making my way there and enjoying the patio, I decided the food was my next venture.\n\nAfter my second, alcohol only, visit, I was excited to taste what vegetarian options they had.  I had the grilled cheese with spicy asparagus and portobello.  Let me tell you...grilled cheese is amazing, add a few interesting touches, it becomes addicting.  I was very happy with my sandwich.  Also, they have a very tasty appetizer of Goat Cheese Fritters with a red wine sauce.  Goat Cheese is one of my favorites and frying anything makes it better. I was in love.  \nTher service is great and they can accomadate large groups, the few times I've been has been with 7-20 people.  Great staff, awesome menu choices, I'll be going back"""
1.0	"b""((( LADIES BEWARE))) Don't ever take your machine to 35th Ave. sew and vac on Northern they broke my Elna machine while it was being repaired. I've spent over $10.000 at their store over the years and have been a long time customer .. Bill the owners son was so rude to me and did nothing to resolve my broken machine. I was disgusted when Bill the owners daughter wouldn't do Any thing to help me when the repair man broke my machine. It's terrible to bring a nice sewing machine in to be repaired and these people broke it while in their possession and they don't want to do a damm thing about it. It was like a big (screw you) to me. I won't buy another thing from these people for the way I was treated. Even the material is too over priced. I'm in the market for another machine but I won't go there ever again. My machine STILL NEEDS TO BE TAKEN CARE OF AND THEY STILL HAVE NOT RESOLVED THIS ISSUE. ITS STILL BROKEN AND IT HAPPENED WHILE REPAIRMAN WAS SERVICING MY MACHINE. I WISH I HAD NEVER TAKEN MY MACHINE TO 35TH AVE SEW AND VAC SHOP. WHY CANT PEOPLE OWN UP TO TAKE OWNERSHIP TO THEIR RESPONSIBILITY FOR THEIR OWN MISTAKES!!!! GO TO KINGS SEWING MACHINES MUCH BETTER SERVICE AND THEY DONT BREAK YOUR MACHINE!!!!!"""
5.0	b'Great tanning salon near me, and clean, equipped with the latest tech and easy checkin and out spot for a short yet amazing relaxation and sunbathing time in chilli Cleveland. I am going to be obsessed with this place in winters and will recharge myself with vitamin D!'
